{
  "$schema": "https://json-schema.org/draft/2020-12/schema",
  "title": "Projection Context v1",
  "type": "object",
  "additionalProperties": false,
  "required": [
    "context_id",
    "context_version",
    "subject_scope",
    "target_domain",
    "application_context",
    "output_intent",
    "constraints",
    "parameters",
    "extensions"
  ],
  "properties": {
    "context_id": {
      "type": "string",
      "minLength": 1
    },
    "context_version": {
      "type": "string",
      "minLength": 1
    },
    "subject_scope": {
      "type": "string",
      "minLength": 1
    },
    "relationship_type": {
      "type": [
        "string",
        "null"
      ]
    },
    "age_band": {
      "type": [
        "string",
        "null"
      ]
    },
    "target_domain": {
      "type": "string",
      "minLength": 1
    },
    "application_context": {
      "type": "string",
      "minLength": 1
    },
    "audience": {
      "type": [
        "string",
        "null"
      ]
    },
    "output_intent": {
      "type": "string"
    },
    "constraints": {
      "type": "object"
    },
    "parameters": {
      "type": "object"
    },
    "extensions": {
      "type": "object"
    }
  }
}
